{
  "schema_version": "runtime_agent_manifest_v1",
  "runtime_agent_count": 25,
  "runtime_stage_count": 26,
  "canonical_l4_sequence": [
    "alpha_discovery",
    "cio_proposal",
    "cro_review",
    "execution_feasibility",
    "cio_final"
  ],
  "agents": [
    {
      "agent": "central_bank",
      "layer": "macro",
      "prompt_ir_agent_id": "macro.central_bank",
      "required_tools": [
        "get_rke_research_context",
        "get_pboc_ops",
        "get_fred_series",
        "get_yield_curve_cn"
      ],
      "output_schema_fields": [
        "stance",
        "key_rate_change_bps",
        "qe_qt_balance_change",
        "next_window",
        "key_drivers",
        "confidence"
      ],
      "stages": [
        {
          "stage": "agent_run",
          "enablement": "legacy",
          "output_schema_ref": "macro.central_bank.output.v1",
          "fallback_factory_id": "macro.central_bank.agent_run.fallback",
          "fallback_factory_version": "1",
          "required_source_ids": [],
          "produced_source_ids": [
            "upstream_agent_outputs"
          ]
        }
      ]
    },
    {
      "agent": "geopolitical",
      "layer": "macro",
      "prompt_ir_agent_id": "macro.geopolitical",
      "required_tools": [
        "get_rke_research_context",
        "get_us_china_relations",
        "get_industry_policy"
      ],
      "output_schema_fields": [
        "escalation_level",
        "hot_zones",
        "trade_impact",
        "key_drivers",
        "confidence"
      ],
      "stages": [
        {
          "stage": "agent_run",
          "enablement": "legacy",
          "output_schema_ref": "macro.geopolitical.output.v1",
          "fallback_factory_id": "macro.geopolitical.agent_run.fallback",
          "fallback_factory_version": "1",
          "required_source_ids": [],
          "produced_source_ids": [
            "upstream_agent_outputs"
          ]
        }
      ]
    },
    {
      "agent": "china",
      "layer": "macro",
      "prompt_ir_agent_id": "macro.china",
      "required_tools": [
        "get_rke_research_context",
        "get_industry_policy",
        "get_policy_uncertainty",
        "get_pboc_ops",
        "get_property_data"
      ],
      "output_schema_fields": [
        "policy_direction",
        "sector_focus",
        "risk_drivers",
        "key_drivers",
        "confidence"
      ],
      "stages": [
        {
          "stage": "agent_run",
          "enablement": "legacy",
          "output_schema_ref": "macro.china.output.v1",
          "fallback_factory_id": "macro.china.agent_run.fallback",
          "fallback_factory_version": "1",
          "required_source_ids": [],
          "produced_source_ids": [
            "upstream_agent_outputs"
          ]
        }
      ]
    },
    {
      "agent": "dollar",
      "layer": "macro",
      "prompt_ir_agent_id": "macro.dollar",
      "required_tools": [
        "get_rke_research_context",
        "get_fred_series",
        "get_usdcny",
        "get_us_china_spread"
      ],
      "output_schema_fields": [
        "dxy_trend",
        "cny_pressure",
        "dxy_cny_correlation",
        "key_drivers",
        "confidence"
      ],
      "stages": [
        {
          "stage": "agent_run",
          "enablement": "legacy",
          "output_schema_ref": "macro.dollar.output.v1",
          "fallback_factory_id": "macro.dollar.agent_run.fallback",
          "fallback_factory_version": "1",
          "required_source_ids": [],
          "produced_source_ids": [
            "upstream_agent_outputs"
          ]
        }
      ]
    },
    {
      "agent": "yield_curve",
      "layer": "macro",
      "prompt_ir_agent_id": "macro.yield_curve",
      "required_tools": [
        "get_rke_research_context",
        "get_yield_curve_cn",
        "get_fred_series",
        "get_us_china_spread"
      ],
      "output_schema_fields": [
        "curve_shape",
        "recession_signal",
        "cn_us_spread_bps",
        "key_drivers",
        "confidence"
      ],
      "stages": [
        {
          "stage": "agent_run",
          "enablement": "legacy",
          "output_schema_ref": "macro.yield_curve.output.v1",
          "fallback_factory_id": "macro.yield_curve.agent_run.fallback",
          "fallback_factory_version": "1",
          "required_source_ids": [],
          "produced_source_ids": [
            "upstream_agent_outputs"
          ]
        }
      ]
    },
    {
      "agent": "commodities",
      "layer": "macro",
      "prompt_ir_agent_id": "macro.commodities",
      "required_tools": [
        "get_rke_research_context",
        "get_commodity_prices",
        "get_yield_curve_cn"
      ],
      "output_schema_fields": [
        "oil_regime",
        "metals_regime",
        "ag_regime",
        "china_demand_signal",
        "key_drivers",
        "confidence"
      ],
      "stages": [
        {
          "stage": "agent_run",
          "enablement": "legacy",
          "output_schema_ref": "macro.commodities.output.v1",
          "fallback_factory_id": "macro.commodities.agent_run.fallback",
          "fallback_factory_version": "1",
          "required_source_ids": [],
          "produced_source_ids": [
            "upstream_agent_outputs"
          ]
        }
      ]
    },
    {
      "agent": "volatility",
      "layer": "macro",
      "prompt_ir_agent_id": "macro.volatility",
      "required_tools": [
        "get_rke_research_context",
        "get_fred_series",
        "get_ivx",
        "get_realized_volatility",
        "get_etf_indicator"
      ],
      "output_schema_fields": [
        "vix_regime",
        "ivx_regime",
        "regime_filter",
        "key_drivers",
        "confidence"
      ],
      "stages": [
        {
          "stage": "agent_run",
          "enablement": "legacy",
          "output_schema_ref": "macro.volatility.output.v1",
          "fallback_factory_id": "macro.volatility.agent_run.fallback",
          "fallback_factory_version": "1",
          "required_source_ids": [],
          "produced_source_ids": [
            "upstream_agent_outputs"
          ]
        }
      ]
    },
    {
      "agent": "emerging_markets",
      "layer": "macro",
      "prompt_ir_agent_id": "macro.emerging_markets",
      "required_tools": [
        "get_rke_research_context",
        "get_etf_price_data",
        "get_us_china_spread",
        "get_fred_series",
        "get_etf_info",
        "get_etf_nav",
        "get_etf_universe"
      ],
      "output_schema_fields": [
        "em_relative",
        "hk_a_share_ratio",
        "capital_flow",
        "key_drivers",
        "confidence"
      ],
      "stages": [
        {
          "stage": "agent_run",
          "enablement": "legacy",
          "output_schema_ref": "macro.emerging_markets.output.v1",
          "fallback_factory_id": "macro.emerging_markets.agent_run.fallback",
          "fallback_factory_version": "1",
          "required_source_ids": [],
          "produced_source_ids": [
            "upstream_agent_outputs"
          ]
        }
      ]
    },
    {
      "agent": "news_sentiment",
      "layer": "macro",
      "prompt_ir_agent_id": "macro.news_sentiment",
      "required_tools": [
        "get_rke_research_context",
        "get_news",
        "get_caixin_sentiment",
        "get_industry_policy"
      ],
      "output_schema_fields": [
        "retail_sentiment_score",
        "hot_topics",
        "contrarian_flag",
        "key_drivers",
        "confidence"
      ],
      "stages": [
        {
          "stage": "agent_run",
          "enablement": "legacy",
          "output_schema_ref": "macro.news_sentiment.output.v1",
          "fallback_factory_id": "macro.news_sentiment.agent_run.fallback",
          "fallback_factory_version": "1",
          "required_source_ids": [],
          "produced_source_ids": [
            "upstream_agent_outputs"
          ]
        }
      ]
    },
    {
      "agent": "institutional_flow",
      "layer": "macro",
      "prompt_ir_agent_id": "macro.institutional_flow",
      "required_tools": [
        "get_rke_research_context",
        "get_lhb_ranking",
        "get_fund_flow",
        "get_stock_moneyflow"
      ],
      "output_schema_fields": [
        "main_net_flow_cny",
        "top_buyers",
        "sectors_in_out",
        "key_drivers",
        "confidence"
      ],
      "stages": [
        {
          "stage": "agent_run",
          "enablement": "legacy",
          "output_schema_ref": "macro.institutional_flow.output.v1",
          "fallback_factory_id": "macro.institutional_flow.agent_run.fallback",
          "fallback_factory_version": "1",
          "required_source_ids": [],
          "produced_source_ids": [
            "upstream_agent_outputs"
          ]
        }
      ]
    },
    {
      "agent": "semiconductor",
      "layer": "sector",
      "prompt_ir_agent_id": "sector.semiconductor",
      "required_tools": [
        "get_rke_research_context",
        "get_industry_policy_digest",
        "get_broker_research",
        "get_etf_holdings",
        "get_stock_data",
        "get_indicators",
        "get_income_statement",
        "get_balance_sheet",
        "get_cashflow",
        "get_industry_moneyflow"
      ],
      "output_schema_fields": [
        "longs",
        "shorts",
        "sector_score",
        "key_drivers",
        "confidence"
      ],
      "stages": [
        {
          "stage": "agent_run",
          "enablement": "legacy",
          "output_schema_ref": "sector.semiconductor.output.v1",
          "fallback_factory_id": "sector.semiconductor.agent_run.fallback",
          "fallback_factory_version": "1",
          "required_source_ids": [],
          "produced_source_ids": [
            "upstream_agent_outputs"
          ]
        }
      ]
    },
    {
      "agent": "energy",
      "layer": "sector",
      "prompt_ir_agent_id": "sector.energy",
      "required_tools": [